{
    "schema": 1,
    "layer": "traffic",
    "scope": "CH",
    "status": "setup",
    "source": "ASTRA · opentransportdata.swiss",
    "sourceUrl": "https://opentransportdata.swiss/",
    "generatedAt": "2026-09-28T14:30:00Z",
    "updatedAt": null,
    "note": {
        "key": "layer.traffic.note.CH"
    },
    "coverage": [],
    "issues": [],
    "stats": {},
    "items": []
}
