{
    "schema": 1,
    "layer": "news",
    "scope": "global",
    "status": "ok",
    "source": "ORF · tagesschau · SRF",
    "sourceUrl": "https://www.tagesschau.de/infoservices/rssfeeds",
    "generatedAt": "2026-09-28T14:30:00Z",
    "updatedAt": "2026-09-28T14:11:06Z",
    "note": {
        "key": "layer.news.note"
    },
    "coverage": [],
    "issues": [],
    "stats": {},
    "items": [
        {
            "kind": "news",
            "id": "tagesschau:fe7ada30-2dfe-492e-8067-eedf70ca5984",
            "title": "Polen investiert massiv in die Drohnenabwehr an der Ostgrenze",
            "url": "https://www.tagesschau.de/ausland/europa/polen-drohnen-abwehr-100.html",
            "source": "tagesschau.de",
            "time": "2026-09-28T14:11:06Z",
            "regionIds": [],
            "regionMatch": "none",
            "lang": "de",
            "category": "conflict",
            "feed": "tagesschau"
        },
        {
            "kind": "news",
            "id": "tagesschau:92612f5d-97e0-4236-b4a7-f6d91e7c2412",
            "title": "Akademie der Wissenschaften in Kiew steht nach russischem Angriff in Flammen",
            "url": "https://www.tagesschau.de/ausland/europa/russische-angriffe-kiew-100.html",
            "source": "tagesschau.de",
            "time": "2026-09-28T14:03:39Z",
            "regionIds": [],
            "regionMatch": "none",
            "lang": "de",
            "category": "conflict",
            "feed": "tagesschau"
        },
        {
            "kind": "news",
            "id": "orf:https://orf.at/stories/3443509/",
            "title": "SpaceX-Rakete „Starship“ erreicht erstmals Erdumlaufbahn",
            "url": "https://orf.at/stories/3443509/",
            "source": "ORF.at",
            "time": "2026-09-28T13:53:35Z",
            "regionIds": [],
            "regionMatch": "none",
            "lang": "de",
            "category": "conflict",
            "feed": "orf"
        },
        {
            "kind": "news",
            "id": "srf:urn:srf:article:01a0e62d-4d9b-31a2-cdb1-653bb7bd56cb",
            "title": "Krieg im Nahen Osten – Wegen US-Sanktionen: Iran beschwert sich bei UNO-Luftfahrtbehörde",
            "url": "https://www.srf.ch/news/international/nahost/krieg-im-nahen-osten-wegen-us-sanktionen-iran-beschwert-sich-bei-uno-luftfahrtbehoerde",
            "source": "SRF News",
            "time": "2026-09-28T12:34:08Z",
            "regionIds": [],
            "regionMatch": "none",
            "lang": "de",
            "category": "conflict",
            "feed": "srf"
        },
        {
            "kind": "news",
            "id": "srf:urn:srf:article:01a0e612-efbf-6379-de42-412e3c4f757f",
            "title": "Krieg in der Ukraine – Kaja Kallas: Russland hat kein Interesse an Frieden",
            "url": "https://www.srf.ch/news/international/ukraine/krieg-in-der-ukraine-kaja-kallas-russland-hat-kein-interesse-an-frieden",
            "source": "SRF News",
            "time": "2026-09-28T12:33:46Z",
            "regionIds": [],
            "regionMatch": "none",
            "lang": "de",
            "category": "conflict",
            "feed": "srf"
        },
        {
            "kind": "news",
            "id": "tagesschau:16b72aa5-05b5-4989-a8b3-6cd53eac0717",
            "title": "Hohe Ethanolpreise: Südzucker erwartet bessere Geschäfte",
            "url": "https://www.tagesschau.de/wirtschaft/finanzen/marktbericht-suedzucker-100.html",
            "source": "tagesschau.de",
            "time": "2026-09-28T12:18:56Z",
            "regionIds": [],
            "regionMatch": "none",
            "lang": "de",
            "category": "conflict",
            "feed": "tagesschau"
        },
        {
            "kind": "news",
            "id": "orf:https://orf.at/stories/3443492/",
            "title": "EU verhängt nach Duma-Wahl in Russland neue Sanktionen",
            "url": "https://orf.at/stories/3443492/",
            "source": "ORF.at",
            "time": "2026-09-28T11:58:48Z",
            "regionIds": [],
            "regionMatch": "none",
            "lang": "de",
            "category": "conflict",
            "feed": "orf"
        },
        {
            "kind": "news",
            "id": "tagesschau:995daed3-3442-41d2-8faf-d4f5c5a058ca",
            "title": "Indien und Nepal: Viele Tote wegen Überschwemmungen",
            "url": "https://www.tagesschau.de/ausland/asien/nepal-indien-flutkatastrophe-100.html",
            "source": "tagesschau.de",
            "time": "2026-09-28T11:51:03Z",
            "regionIds": [],
            "regionMatch": "none",
            "lang": "de",
            "category": "weather",
            "feed": "tagesschau"
        },
        {
            "kind": "news",
            "id": "tagesschau:fc203b01-84e6-4cdb-9ddf-820f1738398b",
            "title": "Steinmeier: \"Schützen wir unser Verfassungsgericht vor möglichen Angriffen\"",
            "url": "https://www.tagesschau.de/inland/festakt-bundesverfassungsgericht-steinmeier-100.html",
            "source": "tagesschau.de",
            "time": "2026-09-28T11:41:05Z",
            "regionIds": [],
            "regionMatch": "none",
            "lang": "de",
            "category": "conflict",
            "feed": "tagesschau"
        },
        {
            "kind": "news",
            "id": "orf:https://orf.at/stories/3443477/",
            "title": "Dürre: Totschnig verweist auf Bedeutung der Agrarförderungen",
            "url": "https://orf.at/stories/3443477/",
            "source": "ORF.at",
            "time": "2026-09-28T09:41:31Z",
            "regionIds": [],
            "regionMatch": "none",
            "lang": "de",
            "category": "weather",
            "feed": "orf"
        },
        {
            "kind": "news",
            "id": "orf:https://orf.at/stories/3443471/",
            "title": "Überschwemmungen in Indien und Nepal: Schon über 100 Tote",
            "url": "https://orf.at/stories/3443471/",
            "source": "ORF.at",
            "time": "2026-09-28T09:04:06Z",
            "regionIds": [],
            "regionMatch": "none",
            "lang": "de",
            "category": "weather",
            "feed": "orf"
        },
        {
            "kind": "news",
            "id": "orf:https://orf.at/stories/3443466/",
            "title": "US-Iran-Verhandlungen ungewiss: Ölpreis steigt erneut",
            "url": "https://orf.at/stories/3443466/",
            "source": "ORF.at",
            "time": "2026-09-28T07:57:55Z",
            "regionIds": [],
            "regionMatch": "none",
            "lang": "de",
            "category": "conflict",
            "feed": "orf"
        },
        {
            "kind": "news",
            "id": "srf:urn:srf:article:01a0e3b6-7610-85ad-00b9-cdf48353a01d",
            "title": "Neutralitätsinitiative – Internationale Medien reagieren auf Entscheid zu Neutralität",
            "url": "https://www.srf.ch/news/schweiz/neutralitaetsinitiative-internationale-medien-reagieren-auf-entscheid-zu-neutralitaet",
            "source": "SRF News",
            "time": "2026-09-28T06:21:52Z",
            "regionIds": [],
            "regionMatch": "none",
            "lang": "de",
            "category": "conflict",
            "feed": "srf"
        },
        {
            "kind": "news",
            "id": "tagesschau:a09564cc-3550-41aa-8bc7-8c88dc7014e1",
            "title": "Israels Wahlkampf mit harten Bandagen - Ausschluss arabischer Parteien?",
            "url": "https://www.tagesschau.de/ausland/asien/israel-wahlen-parteien-arabisch-100.html",
            "source": "tagesschau.de",
            "time": "2026-09-28T03:54:40Z",
            "regionIds": [],
            "regionMatch": "none",
            "lang": "de",
            "category": "conflict",
            "feed": "tagesschau"
        }
    ]
}
